timestamp,user_id,image_id,iteration,image_name,vlm_prompt,raw_description,fkgl_raw,fre_raw,principle_status,regenerate_desc_1,regenerate_desc_2,regenerate_desc_3,final_description,fkgl_final,fre_final,compliance_score,cai_iterations,rating,comment,tone,summary_type
2026-04-20 10:22:43,12,5776a48a,1,89.png,"Describe this chart in detail for a blind student learning about data visualization. Focus on conveying the overall trend and key data points. Explain the type of chart, the axes labels and their units, and the relationship between the data presented. Use complete sentences and avoid visual terms like ""above,"" ""below,"" ""color,"" or ""shape."" Instead, use comparative language like ""higher than,"" ""lower than,"" or ""increasing."" Provide numerical values where possible to illustrate the data. Write the entire description in plain text, using only standard English characters. Do not use any markdown formatting, asterisks, or bullet points.

MANDATORY: You MUST write the entire image description in English ONLY.","This is a decision tree diagram. It illustrates a series of choices and their resulting outcomes, likely related to transportation. The diagram begins with a question at the top labeled “Weather?” and branches out from there. 

From the “Weather?” question, there are two possible answers leading to two branches. One branch is labeled “Sun” and the other is labeled “Rain.” The “Sun” branch then leads to another question, “Time?” 

The “Time?” question has two possible answers, represented by branches. One branch indicates “> 30 mins” meaning greater than 30 minutes, and the other indicates “< 30 mins” meaning less than 30 minutes. The “> 30 mins” branch leads to the outcome “Walk.” The “< 30 mins” branch leads to the outcome “Bus.”

Returning to the “Rain” branch from the initial “Weather?” question, it leads to a question labeled “Hungry?” This question also has two possible answers. A “Yes” answer leads to the outcome “Walk.” A “No” answer leads to the outcome “Bus.”

Finally, the “Cloud” branch from the initial “Weather?” question leads to the outcome “Bus.”

In summary, the diagram shows that if the weather is sunny and the time is greater than 30 minutes, the recommended action is to walk. If the weather is sunny and the time is less than 30 minutes, the recommended action is to take the bus. If the weather is rainy and someone is hungry, the recommended action is to walk. If the weather is rainy and someone is not hungry, the recommended action is to take the bus. If the weather is cloudy, the recommended action is to take the bus. 

The diagram presents a set of rules for deciding between walking and taking the bus based on weather conditions and, in some cases, hunger and time.",6.27,70.79,"{""P1"": ""satisfied"", ""P2"": ""satisfied"", ""P3"": ""violated"", ""P4"": ""satisfied"", ""P5"": ""satisfied"", ""P6"": ""violated"", ""P7"": ""satisfied"", ""P8"": ""violated"", ""P9"": ""satisfied"", ""P10"": ""violated""}","This is a decision tree diagram. The diagram is structured as a series of branching questions and resulting outcomes. The diagram illustrates a decision-making process based on weather, time, and hunger, leading to outcomes of either walking or taking the bus.

The initial question is “Weather?” with three branches: “Sun,” “Rain,” and “Cloud.” The “Sun” branch leads to the question “Time?” which has two branches: “> 30 mins” and “< 30 mins.” The “> 30 mins” branch results in “Walk,” and the “< 30 mins” branch results in “Bus.” The “Rain” branch leads to the question “Hungry?” with branches for “Yes” and “No.” A “Yes” answer results in “Walk,” and a “No” answer results in “Bus.” The “Cloud” branch results in “Bus.”",,,"This is a decision tree diagram. The diagram is structured as a series of branching questions and resulting outcomes. The diagram illustrates a decision-making process based on weather, time, and hunger, leading to outcomes of either walking or taking the bus.

The initial question is “Weather?” with three branches: “Sun,” “Rain,” and “Cloud.” The “Sun” branch leads to the question “Time?” which has two branches: “> 30 mins” and “< 30 mins.” The “> 30 mins” branch results in “Walk,” and the “< 30 mins” branch results in “Bus.” The “Rain” branch leads to the question “Hungry?” with branches for “Yes” and “No.” A “Yes” answer results in “Walk,” and a “No” answer results in “Bus.” The “Cloud” branch results in “Bus.”",4.65,79.27,1.0,2,5,,neutral,short
