timestamp,user_id,image_id,iteration,image_name,vlm_prompt,raw_description,fkgl_raw,fre_raw,principle_status,regenerate_desc_1,regenerate_desc_2,regenerate_desc_3,final_description,fkgl_final,fre_final,compliance_score,cai_iterations,rating,comment,tone,summary_type
2026-03-13 00:11:18,4,67b8af36,1,61.png,"Describe this chart in detail for a blind student learning about data visualization. Focus on conveying the overall trend and key data points. Explain the type of chart, the axes labels and their units, and the relationship between the data presented. Use complete sentences and avoid visual terms like ""above,"" ""below,"" ""color,"" or ""shape."" Instead, use comparative language like ""higher than"" or ""lower than."" Provide numerical values where possible. Write the entire description in plain text, using only English, and do not include any markdown formatting, asterisks, or bullet points.

MANDATORY: You MUST write the entire image description in English ONLY.","This is a scatter plot displaying the relationship between minutes past the hour and the relative probability of a bus arrival. The horizontal axis represents minutes past the hour, ranging from zero to sixty, with each unit representing one minute. The vertical axis represents the relative probability of a bus arrival, ranging from zero to approximately 0.85, with each unit representing 0.1 of a probability. 

The chart contains fifteen data points, each representing a specific combination of minutes past the hour and the corresponding probability of a bus arriving. The data points are scattered across the chart, but a general trend can be observed. 

Initially, between zero and ten minutes past the hour, the probability of a bus arrival is relatively low, starting at a probability of 0.2 and increasing to around 0.6. From ten to twenty minutes past the hour, the probability fluctuates, generally remaining between 0.4 and 0.7. The highest concentration of data points, and therefore the highest probabilities, occur between fifteen and thirty minutes past the hour, with probabilities reaching as high as 0.8. 

As the minutes past the hour increase beyond thirty, the probability of a bus arrival generally decreases. At forty minutes past the hour, the probability is around 0.6, and by fifty-five minutes past the hour, it has fallen to approximately 0.3. The data suggests that buses are more likely to arrive closer to fifteen to thirty minutes past the hour than at the beginning or end of the hour. There is a noticeable decline in probability as the time approaches sixty minutes past the hour.",11.54,39.75,"{""P1"": ""satisfied"", ""P2"": ""satisfied"", ""P3"": ""violated"", ""P4"": ""satisfied"", ""P5"": ""satisfied"", ""P6"": ""violated"", ""P7"": ""satisfied"", ""P8"": ""satisfied"", ""P9"": ""satisfied"", ""P10"": ""violated""}","This is a scatter plot displaying the relationship between minutes past the hour and the relative probability of a bus arrival. The horizontal axis represents minutes past the hour, ranging from zero to sixty, with each unit representing one minute. The vertical axis represents the relative probability of a bus arrival, ranging from zero to approximately 0.85, with each unit representing 0.1 of a probability. The chart contains fifteen data points, each representing a specific combination of minutes past the hour and the corresponding probability of a bus arriving. Between zero and ten minutes past the hour, the probability values range from approximately 0.2 to 0.6. From ten to twenty minutes past the hour, the probability values range from approximately 0.4 to 0.7. Data points between fifteen and thirty minutes past the hour have probability values reaching as high as 0.8. As the minutes past the hour increase beyond thirty, the probability values generally decrease. At forty minutes past the hour, the probability is around 0.6, and by fifty-five minutes past the hour, it has fallen to approximately 0.3. The probability values at sixty minutes past the hour are approximately 0.2.",,,"This is a scatter plot displaying the relationship between minutes past the hour and the relative probability of a bus arrival. The horizontal axis represents minutes past the hour, ranging from zero to sixty, with each unit representing one minute. The vertical axis represents the relative probability of a bus arrival, ranging from zero to approximately 0.85, with each unit representing 0.1 of a probability. The chart contains fifteen data points, each representing a specific combination of minutes past the hour and the corresponding probability of a bus arriving. Between zero and ten minutes past the hour, the probability values range from approximately 0.2 to 0.6. From ten to twenty minutes past the hour, the probability values range from approximately 0.4 to 0.7. Data points between fifteen and thirty minutes past the hour have probability values reaching as high as 0.8. As the minutes past the hour increase beyond thirty, the probability values generally decrease. At forty minutes past the hour, the probability is around 0.6, and by fifty-five minutes past the hour, it has fallen to approximately 0.3. The probability values at sixty minutes past the hour are approximately 0.2.",11.12,38.0,1.0,2,2,,neutral,short
